{
  "$schema": "https://json-schema.org/draft/2020-12/schema",
  "$id": "https://ferros.local/schemas/onramp-decision-rehearsal.schema.json",
  "title": "FERROS Local Onramp Decision Rehearsal",
  "description": "Bounded local-only, non-evidentiary decision-rehearsal receipt emitted by ferros-hub from the published local onramp proposal seam. This receipt records a local operator rehearsal decision only and is not canonical FERROS state, a grant, an accept/reject transport surface, or a partner-facing contract.",
  "type": "object",
  "required": [
    "proposalId",
    "proposalArtifactPath",
    "decisionLabel",
    "scope",
    "evidence",
    "localArtifactPath"
  ],
  "additionalProperties": false,
  "properties": {
    "proposalId": {
      "$ref": "#/$defs/safeText"
    },
    "proposalArtifactPath": {
      "$ref": "#/$defs/safeHubPath"
    },
    "decisionLabel": {
      "type": "string",
      "enum": [
        "allowed",
        "denied:no-grants",
        "denied:profile",
        "denied:capability"
      ]
    },
    "decisionDetail": {
      "$ref": "#/$defs/safeDetail"
    },
    "scope": {
      "const": "local-only"
    },
    "evidence": {
      "const": "non-evidentiary"
    },
    "localArtifactPath": {
      "$ref": "#/$defs/safeHubPath"
    }
  },
  "$defs": {
    "safeText": {
      "type": "string",
      "minLength": 1,
      "pattern": "^(?!\\s*$)(?!//)(?!.*://)(?!.*(?:[Hh][Aa][Rr][Dd][Ww][Aa][Rr][Ee]|[Pp][Rr][Oo][Oo][Ff]|[Ll][Aa][Uu][Nn][Cc][Hh]|[Hh][Oo][Mm][Ee] [Aa][Ss][Ss][Ii][Ss][Tt][Aa][Nn][Tt]|[Pp][Aa][Rr][Tt][Nn][Ee][Rr]|[Gg][Aa][Tt][Ee]|[Gg]4|[Cc][Ll][Oo][Ss][Uu][Rr][Ee]|[Aa][Cc][Cc][Ee][Pp][Tt][Ee][Dd]|[Cc][Aa][Nn][Oo][Nn][Ii][Cc][Aa][Ll]|[Gg][Rr][Aa][Nn][Tt][Ee][Dd])).+$"
    },
    "safeDetail": {
      "$ref": "#/$defs/safeText"
    },
    "safeHubPath": {
      "type": "string",
      "pattern": "^(?!.*://)(?!.*:)(?!.*(?:^|/)\\.\\.(?:/|$))(?!.*(?:[Hh][Aa][Rr][Dd][Ww][Aa][Rr][Ee]|[Pp][Rr][Oo][Oo][Ff]|[Ll][Aa][Uu][Nn][Cc][Hh]|[Hh][Oo][Mm][Ee] [Aa][Ss][Ss][Ii][Ss][Tt][Aa][Nn][Tt]|[Pp][Aa][Rr][Tt][Nn][Ee][Rr]|[Gg][Aa][Tt][Ee]|[Gg]4|[Cc][Ll][Oo][Ss][Uu][Rr][Ee]|[Aa][Cc][Cc][Ee][Pp][Tt][Ee][Dd]|[Cc][Aa][Nn][Oo][Nn][Ii][Cc][Aa][Ll]|[Gg][Rr][Aa][Nn][Tt][Ee][Dd]))\\.tmp/hub/.+\\.json$"
    }
  }
}